<?xml version="1.0" encoding="UTF-8"?>
<xs:schema xmlns:xs="http://www.w3.org/2001/XMLSchema" elementFormDefault="qualified"> 
    <xs:element name="kategorien">
        <xs:complexType>
            <xs:sequence>
                <xs:element name="kategorie" minOccurs="1" maxOccurs="unbounded">
                    <xs:complexType>
                        <xs:sequence>
                            <xs:element name="kategorie_titel" type="xs:string" maxOccurs="1" minOccurs="1"/>
                            <xs:element name="kategorie_beschreibung" type="xs:string" minOccurs="1" maxOccurs="1"/>
                        </xs:sequence>
                        <xs:attribute name="kategorie_id" type="xs:ID" use="required"/>
                    </xs:complexType>
                </xs:element>
            </xs:sequence>
        </xs:complexType>
    </xs:element>
</xs:schema>
